{
  "schema_version": 1,
  "date": "2026-10-19",
  "title": "DDR早报 2026-10-19",
  "summary": "爬虫版早报：采集到 1/8 个价格点，12 条行业动态。",
  "body_markdown": "## 价格面\n\n今日从公开渠道采集到 1/8 个规格的价格数据。\n\n## 供给面\n\n暂无自动分析（爬虫版仅采集原始数据）。\n\n## 厂商动态\n\n- CSP CapEx Projected to Exceed US$1.5 Trillion in 2027, with AI Server Revenue Growing Over 90% YoY on Higher Shipments and Prices, Says TrendForce\n- Rising Costs Threaten Notebook Demand in 2027, Raising Risks of Shipment Declines and Price Increases, Says TrendForce\n- \n- \n- \n\n## 关注点\n\n- 价格数据来源于公开渠道，可能存在延迟\n- 建议交叉验证 TrendForce、DRAMeXchange 等专业渠道报价",
  "price_overview_markdown": "今日采集价格 1/8 个规格。",
  "supply_demand_points": [
    "爬虫版暂不提供供需分析"
  ],
  "outlook_markdown": null,
  "watch_items": [
    "CSP CapEx Projected to Exceed US$1.5 Trillion in 2",
    "Rising Costs Threaten Notebook Demand in 2027, Rai",
    ""
  ],
  "bullish_points": [],
  "bearish_points": [],
  "confidence": "low",
  "generated_at": "2026-10-19T06:20:20.259496Z"
}